{
  "artifact_bindings": {
    "citation_footer_contract_hash": "240bd289771a76a3463ee80ba8f75e7380e3580ce2aa07b83219caecd8c0bb60",
    "claim_source_attribution_report_hash": "8ae89a164bb0bf6169a0e163b09ad98dd9bd19cbc3a460cdc09c82bb32546a6a",
    "rendered_attribution_audit_hash": "c6f4297a83058d8a3dfe646cb1db74894e1dd05671e9bb75c19336c7f10923ec",
    "response_envelope_hash": "6c63ea7396d25b98923d0b8f88642b98518f15d41ae33d8d7decfaee6d505140"
  },
  "binding_report_hash": "c4eafe578d29332f67c356748f9d0bcac62dd33e2c8ea76aa4ef7f478bf8670e",
  "case": {
    "case_id": "artifact:evidence-region-binding",
    "status": "ready"
  },
  "checks": {
    "all_claim_region_links_verified": true,
    "citation_footer_contract_hash_reproducible": true,
    "citation_footer_contract_verified": true,
    "claim_source_attribution_hash_reproducible": true,
    "claim_source_report_ready": true,
    "every_footer_span_prefix_bound": true,
    "every_region_has_public_location": true,
    "every_rendered_claim_span_bound": true,
    "minimum_footer_span_coverage_met": true,
    "minimum_region_coverage_met": true,
    "private_text_not_disclosed": true,
    "region_hashes_reproducible": true,
    "rendered_attribution_audit_hash_reproducible": true,
    "rendered_attribution_audit_ready": true,
    "response_envelope_hash_reproducible": true,
    "source_labels_have_region_rows": true,
    "source_snapshots_have_content_hashes": true,
    "wrong_region_controls_rejected": true
  },
  "claim_region_rows": [
    {
      "checks": {
        "chunk_id_matches_region": true,
        "claim_id_matches_region": true,
        "claim_source_report_accepts_source": true,
        "claim_source_report_grounded": true,
        "claim_source_report_has_claim": true,
        "evidence_hash_matches_region": true,
        "evidence_prefix_in_region": true,
        "region_exists": true,
        "region_location_actionable": true,
        "rendered_char_range_matches": true,
        "rendered_claim_span_exists": true,
        "source_id_matches_region": true,
        "source_label_matches_region": true
      },
      "chunk_id": "arjun-provenance-ledger:c1",
      "claim_id": "claim_1",
      "claim_index": 1,
      "evidence_hash": "399e7ff82b806e565de7e3985f11ff54bb00ce925e6ccd6c4327f412ac297f6e",
      "evidence_span_prefix": "399e7ff82b80",
      "expected_support": true,
      "link_hash": "141ee2ced5820e01cabce6db526ed9bac6121ddd10526401ad69e543a415949e",
      "location_hash": "4f53c5b0dd8e6bf20407dd87e488dfafa682d376e3270013d37709a2550b9642",
      "region_hash": "63f6a786276eed05fb7d376528d490129b1482a9fe90f82e6fd0a97996941aeb",
      "region_id": "region:arjun-provenance-ledger:c1:1",
      "rendered_claim_evidence_row_hash": "fee3c96f25d0f77c1659350226c629748cd8395de42e78ed84e831f4dd4a8aad",
      "source_id": "arjun-provenance-ledger:c1",
      "source_label": "S1",
      "verified": true
    },
    {
      "checks": {
        "chunk_id_matches_region": true,
        "claim_id_matches_region": true,
        "claim_source_report_accepts_source": true,
        "claim_source_report_grounded": true,
        "claim_source_report_has_claim": true,
        "evidence_hash_matches_region": true,
        "evidence_prefix_in_region": true,
        "region_exists": true,
        "region_location_actionable": true,
        "rendered_char_range_matches": true,
        "rendered_claim_span_exists": true,
        "source_id_matches_region": true,
        "source_label_matches_region": true
      },
      "chunk_id": "arjun-provenance-ledger:c1",
      "claim_id": "claim_2",
      "claim_index": 2,
      "evidence_hash": "6ea90fbdd0fb8fcc7aec2615c76ef5e5238e82e459f62189f265905639462c54",
      "evidence_span_prefix": "6ea90fbdd0fb",
      "expected_support": true,
      "link_hash": "edc243cf91095c8eb37095c797925ac9b29e2a9151b50b2f1c45386dcf16f7da",
      "location_hash": "4db913f31e2d63fd965dd63d7061511734b3a6b809a215b4af999e1f4748c4a6",
      "region_hash": "78639dea1b4e201d6791feb2264e2654cb64bef2db549fee1da8bf5ede5225c5",
      "region_id": "region:arjun-provenance-ledger:c1:2",
      "rendered_claim_evidence_row_hash": "5b0c3476c2a2dd5d6791329c388d0e6b71e2646cbeb82462c931cf1192d78b89",
      "source_id": "arjun-provenance-ledger:c1",
      "source_label": "S1",
      "verified": true
    },
    {
      "checks": {
        "chunk_id_matches_region": true,
        "claim_id_matches_region": true,
        "claim_source_report_accepts_source": true,
        "claim_source_report_grounded": true,
        "claim_source_report_has_claim": true,
        "evidence_hash_matches_region": true,
        "evidence_prefix_in_region": true,
        "region_exists": true,
        "region_location_actionable": true,
        "rendered_char_range_matches": true,
        "rendered_claim_span_exists": true,
        "source_id_matches_region": true,
        "source_label_matches_region": true
      },
      "chunk_id": "lina-governance-disputes:c1",
      "claim_id": "claim_3",
      "claim_index": 3,
      "evidence_hash": "71e11e089ebe72376e5099eb3f9ade96cf587ca11a6e9d3d60bfd49ca0423baa",
      "evidence_span_prefix": "71e11e089ebe",
      "expected_support": true,
      "link_hash": "f98b70b4dbda38624a15335f4992cda3dac2c89f491b69caa820e56b68451c96",
      "location_hash": "8891aa335251dd0fb48a36c3eb64e4cffc548c6ea0cd1f26bc3619f0a2fd1a92",
      "region_hash": "5b923b27642a02c4d010711840773a3b70d685b5ce7cd3531a3782056bcf47c9",
      "region_id": "region:lina-governance-disputes:c1:1",
      "rendered_claim_evidence_row_hash": "715dc2dd2e4df7ba176d0253e00fc08466dd7ebc567fc91c6251652e1e124e6c",
      "source_id": "lina-governance-disputes:c1",
      "source_label": "S2",
      "verified": true
    },
    {
      "checks": {
        "chunk_id_matches_region": true,
        "claim_id_matches_region": true,
        "claim_source_report_accepts_source": true,
        "claim_source_report_grounded": true,
        "claim_source_report_has_claim": true,
        "evidence_hash_matches_region": true,
        "evidence_prefix_in_region": true,
        "region_exists": true,
        "region_location_actionable": true,
        "rendered_char_range_matches": true,
        "rendered_claim_span_exists": true,
        "source_id_matches_region": true,
        "source_label_matches_region": true
      },
      "chunk_id": "lina-governance-disputes:c1",
      "claim_id": "claim_4",
      "claim_index": 4,
      "evidence_hash": "82b19c7059e78ab87624c79ca85b89461095efd5a20dc0a2a50c16643ab4a26c",
      "evidence_span_prefix": "82b19c7059e7",
      "expected_support": true,
      "link_hash": "a1de8076f0313aa674800df3d68555f436f341a43aea305726a081e8b102b949",
      "location_hash": "3d1ef976b557d2228f4e8ee2c143ab778e3f80c28dab1c7a8a78ff3940f7cc32",
      "region_hash": "2fa35172bf960109744f099374c9f01467fb50444bd6f4ed5da22e03a46a6ed7",
      "region_id": "region:lina-governance-disputes:c1:2",
      "rendered_claim_evidence_row_hash": "aa63a46b71571f47d905a9d64bb879dfa7ec401205c37ee9d9c50f235f5d9d28",
      "source_id": "lina-governance-disputes:c1",
      "source_label": "S2",
      "verified": true
    },
    {
      "checks": {
        "chunk_id_matches_region": true,
        "claim_id_matches_region": true,
        "claim_source_report_accepts_source": true,
        "claim_source_report_grounded": true,
        "claim_source_report_has_claim": true,
        "evidence_hash_matches_region": true,
        "evidence_prefix_in_region": true,
        "region_exists": true,
        "region_location_actionable": true,
        "rendered_char_range_matches": true,
        "rendered_claim_span_exists": true,
        "source_id_matches_region": true,
        "source_label_matches_region": true
      },
      "chunk_id": "maya-youtube-style-pool:c1",
      "claim_id": "claim_5",
      "claim_index": 5,
      "evidence_hash": "28528b6fc0dbfca22581220c07e210b8b25f663a5ac1108ef3b1d2a69801cdce",
      "evidence_span_prefix": "28528b6fc0db",
      "expected_support": true,
      "link_hash": "50113675aabf27f7d3f0dcac89598d414b275ba5848d19ac3328438d99333586",
      "location_hash": "47a9b98fbcdf4fe8b0ab8399f3804abebe3bec5a0f5764ace1ae83cbaca26076",
      "region_hash": "489c3c1050108eaa2ac221610abe5dbaac8c95722b7d45252ab0c4cbaf60b03b",
      "region_id": "region:maya-youtube-style-pool:c1:1",
      "rendered_claim_evidence_row_hash": "7933be9ba7119914f1b13d511b7f277cf197d9236269600f20b4f4dc474c2069",
      "source_id": "maya-youtube-style-pool:c1",
      "source_label": "S3",
      "verified": true
    },
    {
      "checks": {
        "chunk_id_matches_region": true,
        "claim_id_matches_region": true,
        "claim_source_report_accepts_source": true,
        "claim_source_report_grounded": true,
        "claim_source_report_has_claim": true,
        "evidence_hash_matches_region": true,
        "evidence_prefix_in_region": true,
        "region_exists": true,
        "region_location_actionable": true,
        "rendered_char_range_matches": true,
        "rendered_claim_span_exists": true,
        "source_id_matches_region": true,
        "source_label_matches_region": true
      },
      "chunk_id": "maya-youtube-style-pool:c1",
      "claim_id": "claim_6",
      "claim_index": 6,
      "evidence_hash": "a9ed8431a2594a128f8d8b335e103649ebdfe5c322e03c84a6f270852f1a7145",
      "evidence_span_prefix": "a9ed8431a259",
      "expected_support": true,
      "link_hash": "e80ac8c6efbf1f0f657a26227e460135e0a5ab26a5d1f74c02be54e0855c144e",
      "location_hash": "ae6e5f93f6a7e7253487c76b829608a5759d18824bd6529c788ffd52ee86d37f",
      "region_hash": "21588507c81cdfc66d83995f03060624d9cbefcdf906ba89ecb9647001960c92",
      "region_id": "region:maya-youtube-style-pool:c1:2",
      "rendered_claim_evidence_row_hash": "bf97c2e9f5be0666b9de89ad3b32ed362ef197efd5974a7f9ac2dacad9123542",
      "source_id": "maya-youtube-style-pool:c1",
      "source_label": "S3",
      "verified": true
    }
  ],